name,furigana_name,furigana_initial,prefecture_name,commentary,image,user_id
村上義清,むらかみよしきよ,ま行,,北信濃一帯に覇を唱えた猛将。武田信玄の攻撃を二度とも撃ち破り、勇名を轟かす。しかし、真田幸隆の計略に敗れて信濃を逐われ、越後の長尾景虎を頼った。  ,uemoji-b.png,1
毛利輝元,もうりてるもと,ま行,,元就の嫡孫。お人好しであったという。その性格が災いしてか、関ヶ原合戦では西軍の総大将にされたあげく、敗北。戦後、かろうじて防長二国を安堵された。  ,nagatomitsuboshi-b.png,1
毛利元就,もうりもとなり,ま行,,瀬戸内の謀将。調略によって西国の旧権力や列強を下し、安芸国の一土豪から中国十カ国の太守にまで成り上がった。三人の子に説いた「三矢の訓」は有名。  ,nagatomitsuboshi-b.png,1
最上義光,もがみよしあき,ま行,,出羽の驍将。稀代の策謀家で、父に隠居を強制したうえ、弟を殺して当主となった。その後も政略結婚や邪魔者を抹殺するなどして、最上家の安定を図った。  ,marunifutatsuhiki-b.png,1
森長可,もりながよし,ま行,,森可成の嫡男。「鬼武蔵」と呼ばれた。信長に仕え、長島一向一揆鎮圧などで功を立てる。信長の没後は豊臣秀吉に従って、小牧長久手の合戦で戦死した。  ,moritsurunomaru-b.png,1
森可成,もりよしなり,ま行,,早くから織田信長に仕え、清洲城奪回や桶狭間の合戦などで武功を上げた。近江宇佐山城を守備中に浅井・朝倉連合軍に攻められ、戦死した。  ,moritsurunomaru-b.png,1
森蘭丸,もりらんまる,ま行,,可成の三男で、信長の近臣。利発な少年であり、信長との間に数々の逸話を残している。将来を嘱望されたが、本能寺で信長に殉死。美童の名だけが残った。  ,moritsurunomaru-b.png,1
柳生宗矩,やぎゅうむねのり,や行,,新陰流の剣術家。父・石舟斎宗厳と共に徳川家康に仕え、秀忠・家光の兵法師範を務める。家光の信任厚く、大目付となり、ついで一万石の大名に列せられた。  ,yagyuugasa-b.png,1
山県昌景,やまがたまさかげ,や行,,武田四名臣の１人。昌景が率いる「赤備え」は、武田軍随一の精強軍団である。三方ヶ原の合戦では徳川軍を撃退した。長篠の合戦で銃撃を受け、戦死した。,kikyou-b.png,1
山口重政,やまぐちしげまさ,や行,,徳川家臣。はじめ織田家臣・佐久間信栄に仕える。信栄失脚後は織田信雄に仕え信雄改易後、家康の招きを受けた。しかし、のちに家康の勘気を受け蟄居した。,oouchihishi-b.png,1
山中鹿介,やまなかしかのすけ,や行,,尼子家の忠臣で、「我に七難八苦を…」と願ったというその一生は、尼子家再興に捧げられた。何度も兵を挙げるが失敗し、再興の夢はかなわぬまま死亡した。  ,tachibana-b.png,1
山名祐豊,やまなすけとよ,や行,,但馬守護。山名家の総領として活躍、因幡を支配下に置く。信長の侵攻軍に降った後、毛利家の侵攻にも降ったために再び信長の攻撃を受け、降伏した。  ,yamanakiri-b.png,1
山名豊国,やまなとよくに,や行,,因幡守護。尼子家、毛利家と次々に乗り換え、最後は豊臣秀吉の山陰侵攻軍に降る。秀吉の御咄衆として仕えたが、関ヶ原合戦後は家康の御咄衆となった。  ,yamanakiri-b.png,1
山内一豊,やまのうちかずとよ,や行,,はじめ信長に仕え、妻の「内助の功」もあって出世を遂げた。のち秀吉に仕え、遠江国掛川を領す。関ヶ原の合戦で東軍に属し、その功により土佐一国を得た。  ,tosakashiwa-b.png,1
山本勘助,やまもとかんすけ,や行,,武田信玄の軍師。天文学から兵法まで文武百般に通じた。川中島の合戦では「きつつきの戦法」を考案したが失敗。その責を負って乱軍に突入し、戦死した。  ,santoumigidomoe-b.png,1
遊佐続光,ゆさつぐみつ,や行,,畠山家臣。温井総貞との抗争に敗れて主家を離れたが、総貞の死後に帰参する。上杉・織田に従い、能登の実権奪取を図るが、信長に殺害された。  ,rokkanimutsukarabana-b.png,1
龍造寺隆信,りゅうぞうじたかのぶ,ら行,,曾祖父以来の宿敵・少弐氏を倒した後、大友氏の衰退に乗じて九州の五国二島を領有、「肥前の熊」の異名を取る。沖田畷合戦で島津軍の奇襲を受け戦死した。  ,kawarijuunihiashi-b.png,1
分部光嘉,わけべみつよし,わ行,,本姓細野家。分部家の養子となる。信長の北伊勢侵攻に際しては、抗戦を主張する兄に対して和議を説き、長野家に信長の弟・信包を嗣子として迎え入れた。  ,marunouchinimitsuhiki-b.png,1
渡辺守綱,わたなべもりつな,わ行,,徳川家臣。初陣より各地を転戦、「槍の半蔵」の異名を取る。関ヶ原合戦の際は旗本として参陣。尾張徳川家の家老となり、当主の義直を補佐した。  ,watanabeboshi-b.png,1